title,description
Write a compelling blog post | Generate a catchy headline that grabs attention and accurately reflects the content
Plan a social media campaign | Identify target audience research relevant hashtags and schedule engaging posts
Fix a leaky faucet | Turn off the water supply replace the worn-out washer and tighten the packing nut
Design a logo | Brainstorm initial concepts sketch different ideas and refine the chosen design for clarity and impact
Practice mindfulness meditation | Find a quiet space focus on your breath and acknowledge any distracting thoughts without judgment
Conduct a scientific experiment | Formulate a hypothesis design a controlled experiment collect and analyze data and draw conclusions
Volunteer at a local animal shelter | Walk dogs clean cages and socialize with the animals
Bake a delicious chocolate cake | Preheat the oven cream together butter and sugar add eggs one at a time and fold in dry ingredients
Change a flat tire | Loosen the lug nuts jack up the car remove the flat tire mount the spare tire and tighten the lug nuts securely
Learn a new language | Choose a language learning app or course set realistic goals and practice speaking listening reading and writing regularly